login,location,bio,createdAt,country
Username_31_1,Nigeria,I am Passionate about uncovering insights from data and creating data-driven solutions.,2023-01-16T12:10:56Z,NG
Username_31_2,"Minas Gerais, Brazil","Full-Stack Developer with knowledge of HTML5, CSS3, JavaScript, C/C++ and PHP",2022-01-21T22:58:03Z,BR
Username_31_3,Brazil,I'm just a random guy who makes bug reports and translations to brazilian portuguese,2021-01-15T17:06:55Z,BR
Username_31_4,"Lagos, Nigeria",Software Engineer | Robotic | Web Developer | Computer Instructor | Brand Developer | Graphics Designer | Linux expert,2022-01-14T15:58:14Z,NG
Username_31_5,"2021 Rock Rd, Naples, FL 34120, United States","Anchor Tree Services offers expert tree care, including trimming, removal, and storm damage services. ",2025-01-28T13:10:01Z,US
Username_31_6,United Kingdom,"started just for fun with  Java, C++ and C# and other languages.",2025-01-17T17:43:07Z,UK
Username_31_7,United States,My focus is on developing innovative coding solutions that improve the quality of people's lives and foster positivity.,2022-01-05T01:05:30Z,US
Username_31_8,India,I'm aiming to learn and grow. Excited to discover issues and work on it :),2022-01-03T14:08:17Z,IN
Username_31_9,London United Kingdom,im now an an ALX student.Here is my full reporosity as a full time engineer,2023-01-18T04:57:10Z,UK
Username_31_10,India,Heya! Im Monster An Cheat Developer And The Owner of An CSGO Cheat That Is In Comming. ,2022-01-19T03:47:21Z,IN
